{
  "schema": "grampy-mfsk-encoder-pi-qualification-manifest.v2",
  "status": "failed",
  "source": {
    "repository_revision": "f41c0f922caa27c255e5a91b630497dd09983cf7",
    "matrix": {
      "path": "source/matrix.json",
      "bytes": 5691,
      "sha256": "9c8cba257b3e20861e6978b7c4d33c96f9856d81d9bb3a55d2347282f950fe81"
    },
    "rsid_oracle": {
      "path": "source/rsid-oracle.json",
      "bytes": 3014,
      "sha256": "be9e40eae97b1230d50b6991c2d7c853d9562029a4a38b19f19e561bdd5857ec"
    },
    "encoder_distribution": {
      "path": "source/distribution/radiogrampy-0.1.3-py3-none-any.whl",
      "bytes": 165527,
      "sha256": "b0ff517be6daa4bc32afac0ac2b5914ca1eeedb785d3f28a5b72be24f09834a1"
    },
    "inputs": [
      {
        "path": "inputs/audio-marker.wav",
        "bytes": 96044,
        "sha256": "fde7892eba90d4d705b5fef99aef4c078c4f65b92af23f06cd2af9a8a4a56fca"
      },
      {
        "path": "inputs/primary-color-8x4.png",
        "bytes": 137,
        "sha256": "33e1986427384be02803fe5e8785f3068d17bbacaf6fb6f5b7f880cfea188ea2"
      }
    ]
  },
  "target": {
    "hostname": "pi3BFirst",
    "platform": "Linux-6.18.34+rpt-rpi-v8-aarch64-with-glibc2.41",
    "architecture": "aarch64",
    "python_version": "3.13.5"
  },
  "receiver": {
    "reference_id": "fldigi-4.2.13-pi3-aarch64-7fa6ee2e4178",
    "version": "fldigi 4.2.13",
    "binary": {
      "path": "receiver-binary",
      "bytes": 67143320,
      "sha256": "dd30f86caae1edb5d2998acedb47a3a7b348b727bf6303af1e2f822f549966f3"
    },
    "configuration": {
      "reference_id": "fldigi-4.2.13-pi3-aarch64-7fa6ee2e4178",
      "rxid_enabled": true,
      "rxid_passband_search": true,
      "rxid_notify_only": false,
      "rxid_auto_disable_after_detection": false,
      "rxid_mode_exclusions": [],
      "reverse_sideband": false,
      "initial_mode": "BPSK31",
      "initial_carrier_hz": 1500.0,
      "playback": "one continuous run of the complete generated WAV; no manual mode/frequency selection or window replay"
    }
  },
  "execution": {
    "workflow": "tools/pi-qualify-mfsk-encoder.sh",
    "started_utc": "2026-10-02T03:10:36.413046+00:00",
    "completed_utc": "2026-10-02T03:18:49.503165+00:00",
    "log": {
      "path": "execution.log",
      "bytes": 1242,
      "sha256": "f30305a5d66e7633591c2b5237737482a81d199fa66f847f92f61b130412fb06"
    }
  },
  "cases": [
    {
      "id": "rsid-mfsk32-initial",
      "status": "pass",
      "generated_wav": {
        "path": "cases/rsid-mfsk32-initial/generated.wav",
        "bytes": 788192,
        "sha256": "59359cc866a89a8884e00263aa6784a8af97bece507c5c81ef658298c5fdbe20"
      },
      "encoder_result": {
        "path": "cases/rsid-mfsk32-initial/encoder-result.json",
        "bytes": 565,
        "sha256": "8c0101c6677b7bef874ae358346005f30c6f1f3681087f2d925c5203def70720"
      },
      "continuous_receiver_runs": [
        {
          "input_interval": {
            "start_frame": 0,
            "end_frame": 394074
          },
          "manual_mode_changes": 0,
          "exit_code": 0,
          "log": {
            "path": "cases/rsid-mfsk32-initial/received/fldigi/control.log",
            "bytes": 17920,
            "sha256": "2d5acd8661ef156f92e5b0b9677431240684a86fc15af609347c107dc2ee9fe0"
          },
          "rxid_events": [
            {
              "mode": "MFSK32",
              "code": 147,
              "frequency_hz": 1504.0,
              "receiver_log_evidence": "status during playback: mode='MFSK32' carrier=1504 quality=0.0 afc=0 squelch=0 squelch_level=0.0 rsid=1 status1='' status2='' trx='rx'"
            }
          ],
          "recovered_text": {
            "path": "cases/rsid-mfsk32-initial/received/decoded.txt",
            "bytes": 185,
            "sha256": "c0f7e3c26b38a33c9690d2c261d31763093723ee76409a7b6121091118075aff"
          },
          "recovered_images": []
        }
      ],
      "checks": [
        {
          "id": "whole-wav-receiver-exit",
          "status": "pass",
          "expected": 0,
          "observed": 0,
          "evidence": [
            "cases/rsid-mfsk32-initial/received/metadata.json"
          ]
        },
        {
          "id": "whole-wav-interval-and-no-manual-changes",
          "status": "pass",
          "expected": [
            0,
            394074,
            0
          ],
          "observed": [
            0,
            394074,
            0
          ],
          "evidence": [
            "cases/rsid-mfsk32-initial/received/fldigi/control.log",
            "cases/rsid-mfsk32-initial/command.json"
          ]
        },
        {
          "id": "initial-unrelated-mode",
          "status": "pass",
          "expected": "BPSK31",
          "observed": "BPSK31",
          "evidence": [
            "cases/rsid-mfsk32-initial/received/fldigi/control.log"
          ]
        },
        {
          "id": "receiver-rxid-configuration",
          "status": "pass",
          "expected": {
            "AUDIOIO": "1",
            "PORTINDEVICE": "default",
            "PORTOUTDEVICE": "default",
            "RSIDWIDESEARCH": "1",
            "RSIDNOTIFYONLY": "0",
            "RSIDAUTODISABLE": "0",
            "RSIDRXMODESEXCLUDE": "",
            "DISABLERSIDFREQCHANGE": "0"
          },
          "observed": {
            "AUDIOIO": "1",
            "PORTINDEVICE": "default",
            "PORTOUTDEVICE": "default",
            "RSIDWIDESEARCH": "1",
            "RSIDNOTIFYONLY": "0",
            "RSIDAUTODISABLE": "0",
            "RSIDRXMODESEXCLUDE": "",
            "DISABLERSIDFREQCHANGE": "0"
          },
          "evidence": [
            "cases/rsid-mfsk32-initial/received/fldigi/config-start/fldigi_def.xml",
            "cases/rsid-mfsk32-initial/received/fldigi/control.log"
          ]
        },
        {
          "id": "rxid-acquisitions-in-order",
          "status": "pass",
          "expected": [
            "MFSK32"
          ],
          "observed": [
            "MFSK32"
          ],
          "evidence": [
            "cases/rsid-mfsk32-initial/received/fldigi/control.log"
          ]
        },
        {
          "id": "carrier-acquisitions-in-order",
          "status": "pass",
          "expected": [
            1500.0
          ],
          "observed": [
            1504.0
          ],
          "evidence": [
            "cases/rsid-mfsk32-initial/received/fldigi/control.log"
          ]
        },
        {
          "id": "caller-text-exact-and-ordered",
          "status": "pass",
          "expected": [
            "RSID MFSK32 INITIAL END"
          ],
          "observed": {
            "positions": [
              8
            ],
            "decoded": "s    \n\u0002\nRSID MFSK32 INITIAL END\n\u0004\nu\u00e2\u00a57\b\u00a0rtrs\u00a1reeErs\u00a1reeErs\u00a1reeErs\u00a1reeErs\u00a1reeErs\u00a1reeErs\u00a1reeErs\u00a1reeErs\u00a1reeErs\u00a1reeErs\u00a1reeErs\u00a1reeErs\u00a1reeErs\u00a1reeErs\u00a1reeErs\u00a1reeErs\u00a1reeErs\u00a1"
          },
          "evidence": [
            "cases/rsid-mfsk32-initial/received/decoded.txt"
          ]
        },
        {
          "id": "picture-count",
          "status": "pass",
          "expected": 0,
          "observed": 0,
          "evidence": [
            "cases/rsid-mfsk32-initial/received/metadata.json"
          ]
        },
        {
          "id": "independent-rsid-oracle-pcm",
          "status": "pass",
          "expected": true,
          "observed": true,
          "evidence": [
            "source/rsid-oracle.json",
            "cases/rsid-mfsk32-initial/generated.wav"
          ]
        },
        {
          "id": "prefix-inclusive-frames-and-coordinates",
          "status": "pass",
          "expected": {
            "frames": 394074,
            "starts": [
              {
                "input_index": 0,
                "start_frame": 0,
                "contents": [
                  {
                    "content_index": 0,
                    "start_frame": 159066
                  }
                ]
              }
            ]
          },
          "observed": {
            "frames": 394074,
            "starts": [
              {
                "input_index": 0,
                "start_frame": 0,
                "contents": [
                  {
                    "content_index": 0,
                    "start_frame": 159066
                  }
                ]
              }
            ]
          },
          "evidence": [
            "cases/rsid-mfsk32-initial/encoder-result.json"
          ]
        },
        {
          "id": "picture-announcements-exact",
          "status": "pass",
          "expected": [],
          "observed": "s    \n\u0002\nRSID MFSK32 INITIAL END\n\u0004\nu\u00e2\u00a57\b\u00a0rtrs\u00a1reeErs\u00a1reeErs\u00a1reeErs\u00a1reeErs\u00a1reeErs\u00a1reeErs\u00a1reeErs\u00a1reeErs\u00a1reeErs\u00a1reeErs\u00a1reeErs\u00a1reeErs\u00a1reeErs\u00a1reeErs\u00a1reeErs\u00a1reeErs\u00a1reeErs\u00a1",
          "evidence": [
            "cases/rsid-mfsk32-initial/received/decoded.txt"
          ]
        }
      ],
      "discrepancies": []
    },
    {
      "id": "rsid-mfsk64-extended-initial",
      "status": "pass",
      "generated_wav": {
        "path": "cases/rsid-mfsk64-extended-initial/generated.wav",
        "bytes": 803732,
        "sha256": "dad0fb7a516adfadcef1a9225261d5ad2234407f0cc20843f6c896cda39894a9"
      },
      "encoder_result": {
        "path": "cases/rsid-mfsk64-extended-initial/encoder-result.json",
        "bytes": 572,
        "sha256": "abb638a1b2a78c5af410306804e87e8cbac09021989bdabbcb870ed26c41e965"
      },
      "continuous_receiver_runs": [
        {
          "input_interval": {
            "start_frame": 0,
            "end_frame": 401844
          },
          "manual_mode_changes": 0,
          "exit_code": 0,
          "log": {
            "path": "cases/rsid-mfsk64-extended-initial/received/fldigi/control.log",